{
  "$schema": "https://json-schema.org/draft/2020-12/schema",
  "$id": "https://github.com/AMD-Ecosystem/moat/schema/status.schema.json",
  "title": "MOAT per-project status",
  "$comment": "GENERATED by utils/gen_schema.py from moatlib -- do not hand-edit.",
  "type": "object",
  "required": [
    "schema_version",
    "name",
    "upstream_url",
    "fork_default_branch",
    "priority",
    "ext_type",
    "platforms"
  ],
  "properties": {
    "schema_version": {
      "enum": [
        2,
        3
      ]
    },
    "name": {
      "type": "string"
    },
    "upstream_url": {
      "type": "string"
    },
    "upstream_repo_id": {
      "type": [
        "integer",
        "null"
      ]
    },
    "fork_url": {
      "type": [
        "string",
        "null"
      ]
    },
    "fork_default_branch": {
      "type": "string"
    },
    "fork_branch": {
      "type": "string",
      "description": "port branch when it is not moat-port"
    },
    "priority": {
      "type": "number"
    },
    "ext_type": {
      "type": "string",
      "minLength": 1
    },
    "adopted_at": {
      "type": [
        "string",
        "null"
      ]
    },
    "updated_at": {
      "type": [
        "string",
        "null"
      ]
    },
    "head_sha": {
      "type": [
        "string",
        "null"
      ],
      "description": "current fork branch HEAD"
    },
    "depends_on": {
      "type": "array",
      "items": {
        "type": "string"
      }
    },
    "on_hold": {
      "type": "boolean"
    },
    "on_hold_reason": {
      "type": [
        "string",
        "null"
      ]
    },
    "porting": {
      "type": [
        "object",
        "null"
      ],
      "required": [
        "arch",
        "since"
      ],
      "properties": {
        "arch": {
          "type": "string",
          "pattern": "^(linux|windows)-(gfx[0-9a-f]+)$"
        },
        "since": {
          "type": "string"
        }
      }
    },
    "porting_released": {
      "type": [
        "object",
        "null"
      ],
      "required": [
        "arch",
        "since",
        "at"
      ],
      "properties": {
        "arch": {
          "type": "string",
          "pattern": "^(linux|windows)-(gfx[0-9a-f]+)$"
        },
        "since": {
          "type": "string"
        },
        "at": {
          "type": "string"
        }
      }
    },
    "waivers": {
      "type": "object",
      "propertyNames": {
        "enum": [
          "wave64",
          "windows"
        ]
      },
      "additionalProperties": {
        "type": "object",
        "required": [
          "reason"
        ],
        "properties": {
          "reason": {
            "type": "string",
            "minLength": 1
          },
          "suggested_at": {
            "type": "string"
          },
          "approved_by": {
            "type": "string",
            "minLength": 1
          },
          "at": {
            "type": "string"
          },
          "refused_by": {
            "type": "string",
            "minLength": 1
          },
          "refused_at": {
            "type": "string"
          },
          "refused_note": {
            "type": "string",
            "minLength": 1
          }
        }
      }
    },
    "license_spdx": {
      "type": [
        "string",
        "null"
      ]
    },
    "intake": {
      "type": [
        "object",
        "null"
      ],
      "required": [
        "verdict",
        "summary"
      ],
      "properties": {
        "verdict": {
          "enum": [
            "fork",
            "decline"
          ]
        },
        "reason": {
          "type": [
            "string",
            "null"
          ]
        },
        "duplicate_effort": {
          "type": [
            "string",
            "null"
          ]
        },
        "viable": {
          "type": [
            "boolean",
            "null"
          ]
        },
        "summary": {
          "type": "string"
        },
        "at": {
          "type": "string"
        },
        "decided": {
          "type": [
            "object",
            "null"
          ],
          "required": [
            "choice",
            "by",
            "at"
          ],
          "properties": {
            "choice": {
              "enum": [
                "fork",
                "decline"
              ]
            },
            "by": {
              "type": "string",
              "minLength": 1
            },
            "at": {
              "type": "string"
            },
            "note": {
              "type": "string"
            }
          }
        }
      }
    },
    "license_clearance": {
      "type": [
        "object",
        "null"
      ],
      "required": [
        "approved_by",
        "at"
      ],
      "properties": {
        "approved_by": {
          "type": "string",
          "minLength": 1
        },
        "at": {
          "type": "string"
        },
        "tier": {
          "type": "integer"
        },
        "note": {
          "type": "string"
        }
      }
    },
    "pr_state": {
      "enum": [
        "open",
        "merged",
        "closed"
      ]
    },
    "pr_url": {
      "type": "string"
    },
    "pr_number": {
      "type": "integer"
    },
    "pr_opened_at": {
      "type": "string"
    },
    "pr_merged_at": {
      "type": "string"
    },
    "pr_closed_at": {
      "type": "string"
    },
    "pr_closed_note": {
      "type": "string"
    },
    "published_sha": {
      "type": [
        "string",
        "null"
      ]
    },
    "pr_round": {
      "type": "integer",
      "minimum": 1
    },
    "pr_history": {
      "type": "array",
      "items": {
        "type": "object",
        "required": [
          "pr_url",
          "pr_number",
          "pr_state",
          "published_sha",
          "archived_at"
        ],
        "properties": {
          "pr_url": {
            "type": "string"
          },
          "pr_number": {
            "type": "integer"
          },
          "pr_state": {
            "enum": [
              "merged",
              "closed"
            ]
          },
          "pr_opened_at": {
            "type": "string"
          },
          "pr_merged_at": {
            "type": "string"
          },
          "pr_closed_at": {
            "type": "string"
          },
          "pr_closed_note": {
            "type": "string"
          },
          "published_sha": {
            "type": "string"
          },
          "review_pr": {
            "type": "string"
          },
          "archived_at": {
            "type": "string"
          }
        }
      }
    },
    "fix": {
      "type": [
        "object",
        "null"
      ],
      "required": [
        "branch",
        "base_sha"
      ],
      "properties": {
        "branch": {
          "type": "string",
          "minLength": 1
        },
        "base_sha": {
          "type": "string",
          "minLength": 1
        },
        "review_pr": {
          "type": [
            "string",
            "null"
          ]
        },
        "opened_at": {
          "type": "string"
        },
        "kind": {
          "enum": [
            "sync"
          ]
        },
        "upstream_sha": {
          "type": "string",
          "minLength": 1
        }
      }
    },
    "fix_merged_at": {
      "type": "string"
    },
    "maintained": {
      "type": [
        "object",
        "null"
      ],
      "required": [
        "evidence",
        "by",
        "at"
      ],
      "properties": {
        "evidence": {
          "type": "string",
          "minLength": 1
        },
        "by": {
          "type": "string",
          "minLength": 1
        },
        "at": {
          "type": "string"
        },
        "note": {
          "type": "string"
        }
      }
    },
    "no_upstream": {
      "type": [
        "object",
        "null"
      ],
      "required": [
        "evidence",
        "by",
        "at"
      ],
      "properties": {
        "evidence": {
          "type": "string",
          "minLength": 1
        },
        "by": {
          "type": "string",
          "minLength": 1
        },
        "at": {
          "type": "string"
        },
        "note": {
          "type": "string"
        }
      }
    },
    "review_pr": {
      "type": "string"
    },
    "pr_approval": {
      "type": [
        "object",
        "null"
      ],
      "required": [
        "approved_by",
        "at",
        "head_sha",
        "content_sha256"
      ],
      "properties": {
        "approved_by": {
          "type": "string",
          "minLength": 1
        },
        "at": {
          "type": "string"
        },
        "head_sha": {
          "type": "string"
        },
        "content_sha256": {
          "type": "string",
          "pattern": "^[0-9a-f]{64}$"
        },
        "review_pr": {
          "type": "string"
        }
      }
    },
    "stage": {
      "enum": [
        "awaiting-fork",
        "awaiting-upstream",
        "changes-requested",
        "delta-ported",
        "not-portable",
        "planned",
        "planning",
        "ported",
        "porting",
        "review-passed",
        "reviewing",
        "screened",
        "unclaimed"
      ]
    },
    "not_portable": {
      "type": [
        "object",
        "null"
      ],
      "required": [
        "reason",
        "by",
        "at"
      ],
      "properties": {
        "reason": {
          "type": "string",
          "minLength": 1
        },
        "by": {
          "type": "string",
          "minLength": 1
        },
        "at": {
          "type": "string"
        }
      }
    },
    "platforms": {
      "type": "object",
      "propertyNames": {
        "pattern": "^(linux|windows)-(gfx[0-9a-f]+)$"
      },
      "additionalProperties": {
        "$ref": "#/$defs/arch"
      }
    }
  },
  "$defs": {
    "archstate": {
      "enum": [
        "completed",
        "validation-failed"
      ]
    },
    "arch": {
      "type": "object",
      "required": [
        "blocked"
      ],
      "properties": {
        "state": {
          "$ref": "#/$defs/archstate"
        },
        "blocked": {
          "type": "boolean"
        },
        "blocked_reason": {
          "type": [
            "string",
            "null"
          ]
        },
        "validated_sha": {
          "type": [
            "string",
            "null"
          ],
          "description": "head this arch last validated"
        },
        "failed_sha": {
          "type": [
            "string",
            "null"
          ],
          "description": "head this arch last failed to validate"
        },
        "pr_url": {
          "type": [
            "string",
            "null"
          ]
        },
        "pr_number": {
          "type": [
            "number",
            "null"
          ]
        },
        "started_at": {
          "type": [
            "string",
            "null"
          ]
        },
        "completed_at": {
          "type": [
            "string",
            "null"
          ]
        },
        "updated_at": {
          "type": [
            "string",
            "null"
          ]
        },
        "last_agent": {
          "type": [
            "string",
            "null"
          ]
        },
        "carry_forward": {
          "type": "object"
        },
        "stats": {
          "type": "object"
        }
      }
    }
  }
}
