{
  "schema_version": 3,
  "name": "h2o4gpu",
  "upstream_url": "https://github.com/h2oai/h2o4gpu",
  "fork_url": "https://github.com/AMD-Ecosystem/h2o4gpu",
  "fork_default_branch": "main",
  "priority": 0.0,
  "ext_type": "unknown",
  "adopted_at": "2026-08-07T07:05:27Z",
  "updated_at": "2026-10-29T22:07:30Z",
  "head_sha": null,
  "depends_on": [],
  "porting": null,
  "waivers": {},
  "license_spdx": "Apache-2.0",
  "intake": {
    "verdict": "fork",
    "reason": null,
    "duplicate_effort": "none",
    "viable": true,
    "summary": "GPU ML solver library (GLM/k-means/PCA/ALS/ARIMA) with real, self-contained CUDA (~30 own .cu/.cuh under src/gpu); Apache-2.0 tier-1, no existing AMD effort, but upstream is dormant (last real merge 2024, before that 2021) so budget for fork-only.",
    "at": "2026-08-07T07:06:56Z",
    "decided": {
      "choice": "fork",
      "by": "jeffdaily",
      "at": "2026-08-07T15:27:16Z"
    }
  },
  "stage": "screened",
  "platforms": {}
}
