{
  "schema_version": 3,
  "name": "CuMesh",
  "upstream_url": "https://github.com/JeffreyXiang/CuMesh",
  "fork_url": "https://github.com/AMD-Ecosystem/CuMesh",
  "fork_default_branch": "main",
  "priority": 0.0,
  "ext_type": "torch-extension",
  "adopted_at": "2026-06-04T23:25:55Z",
  "updated_at": "2026-10-22T07:22:32Z",
  "head_sha": "11533412aaaa8f21f26d7e46d8a468562c41ff96",
  "depends_on": [],
  "pr_url": "https://github.com/JeffreyXiang/CuMesh/pull/36",
  "pr_number": 36,
  "pr_opened_at": "2026-06-19T18:11:32Z",
  "porting": null,
  "waivers": {},
  "pr_state": "open",
  "license_spdx": "MIT",
  "upstream_repo_id": 1097063193,
  "stage": "review-passed",
  "platforms": {
    "linux-gfx90a": {
      "state": "completed",
      "blocked": false,
      "blocked_reason": null,
      "validated_sha": "11533412aaaa8f21f26d7e46d8a468562c41ff96",
      "started_at": "2026-06-04T23:45:55Z",
      "completed_at": "2026-10-20T23:06:40Z",
      "updated_at": "2026-10-20T23:06:40Z",
      "stats": {
        "tokens_total": 0,
        "tokens_approx": true,
        "wall_seconds": {
          "thinking": 0,
          "compile": 0,
          "test": 0,
          "misc": 0
        },
        "session_count": 0,
        "first_session_at": null,
        "last_session_at": null
      },
      "last_agent": "validator",
      "failed_sha": "d5c1355"
    },
    "linux-gfx1100": {
      "state": "completed",
      "blocked": false,
      "blocked_reason": null,
      "validated_sha": "11533412aaaa8f21f26d7e46d8a468562c41ff96",
      "started_at": "2026-08-27T01:44:33Z",
      "completed_at": "2026-08-27T03:16:20Z",
      "updated_at": "2026-08-27T03:16:20Z",
      "stats": {
        "tokens_total": 0,
        "tokens_approx": true,
        "wall_seconds": {
          "thinking": 0,
          "compile": 0,
          "test": 0,
          "misc": 0
        },
        "session_count": 0,
        "first_session_at": null,
        "last_session_at": null
      },
      "last_agent": "validator"
    },
    "windows-gfx1101": {
      "state": "completed",
      "blocked": false,
      "blocked_reason": null,
      "validated_sha": "d5c1355",
      "started_at": null,
      "completed_at": "2026-06-23T14:01:49Z",
      "updated_at": "2026-06-23T14:01:49Z",
      "stats": {
        "tokens_total": 0,
        "tokens_approx": true,
        "wall_seconds": {
          "thinking": 0,
          "compile": 0,
          "test": 0,
          "misc": 0
        },
        "session_count": 0,
        "first_session_at": null,
        "last_session_at": null
      },
      "carry_forward": {
        "to": "d5c1355",
        "method": "source-class",
        "detail": "cubvh submodule repointed AMD-Ecosystem/cubvh@moat-port -> ashawkey/cubvh@main; gitlink e5a657a -> 757b913b has IDENTICAL tree (git diff empty), .gitmodules url/branch are metadata only -> compiled output",
        "at": "2026-06-23T14:01:49Z"
      }
    },
    "windows-gfx1201": {
      "state": "completed",
      "blocked": false,
      "blocked_reason": null,
      "validated_sha": "d5c1355",
      "started_at": null,
      "completed_at": "2026-06-23T14:01:49Z",
      "updated_at": "2026-06-23T14:01:49Z",
      "stats": {
        "tokens_total": 0,
        "tokens_approx": true,
        "wall_seconds": {
          "thinking": 0,
          "compile": 0,
          "test": 0,
          "misc": 0
        },
        "session_count": 0,
        "first_session_at": null,
        "last_session_at": null
      },
      "last_agent": "validator",
      "carry_forward": {
        "to": "d5c1355",
        "method": "source-class",
        "detail": "cubvh submodule repointed AMD-Ecosystem/cubvh@moat-port -> ashawkey/cubvh@main; gitlink e5a657a -> 757b913b has IDENTICAL tree (git diff empty), .gitmodules url/branch are metadata only -> compiled output",
        "at": "2026-06-23T14:01:49Z"
      }
    },
    "linux-gfx942": {
      "blocked": false,
      "blocked_reason": null,
      "validated_sha": "392b4dd41f8b10b795b00e44cb1b294b1388cefa",
      "failed_sha": "392b4dd41f8b10b795b00e44cb1b294b1388cefa",
      "started_at": "2026-08-11T17:50:04Z",
      "completed_at": "2026-08-11T22:09:44Z",
      "updated_at": "2026-08-11T22:09:44Z",
      "stats": {
        "tokens_total": 0,
        "tokens_approx": true,
        "wall_seconds": {
          "thinking": 0,
          "compile": 0,
          "test": 0,
          "misc": 0
        },
        "session_count": 0,
        "first_session_at": null,
        "last_session_at": null
      },
      "last_agent": "validator",
      "state": "completed"
    },
    "windows-gfx1151": {
      "blocked": false,
      "blocked_reason": null,
      "validated_sha": "11533412aaaa8f21f26d7e46d8a468562c41ff96",
      "failed_sha": "392b4dd41f8b10b795b00e44cb1b294b1388cefa",
      "started_at": null,
      "completed_at": "2026-10-20T22:17:04Z",
      "updated_at": "2026-10-20T22:17:04Z",
      "stats": {
        "tokens_total": 0,
        "tokens_approx": true,
        "wall_seconds": {
          "thinking": 0,
          "compile": 0,
          "test": 0,
          "misc": 0
        },
        "session_count": 0,
        "first_session_at": null,
        "last_session_at": null
      },
      "state": "completed",
      "last_agent": "validator"
    }
  },
  "published_sha": "392b4dd41f8b10b795b00e44cb1b294b1388cefa",
  "fix": {
    "branch": "moat-fix-36",
    "base_sha": "392b4dd41f8b10b795b00e44cb1b294b1388cefa",
    "review_pr": "https://github.com/AMD-Ecosystem/CuMesh/pull/1",
    "opened_at": "2026-08-27T01:44:40Z"
  },
  "porting_released": {
    "arch": "linux-gfx1100",
    "since": "2026-08-27T02:52:33Z",
    "at": "2026-08-27T02:55:14Z"
  },
  "pr_approval": {
    "approved_by": "jeffdaily",
    "at": "2026-10-22T07:20:24Z",
    "head_sha": "11533412aaaa8f21f26d7e46d8a468562c41ff96",
    "content_sha256": "d9d0896b101e27441fbadecb3486c7c3f6435981804981a1ce1c71b3de11292a",
    "review_pr": "https://github.com/AMD-Ecosystem/CuMesh/pull/1"
  }
}
