{
  "schema_version": 3,
  "name": "CV-CUDA",
  "upstream_url": "https://github.com/CVCUDA/CV-CUDA",
  "fork_url": "https://github.com/AMD-Ecosystem/CV-CUDA",
  "fork_default_branch": "main",
  "priority": 6.119,
  "ext_type": "cmake",
  "adopted_at": "2026-05-29T23:30:03Z",
  "updated_at": "2026-08-20T17:56:44Z",
  "head_sha": "642b352642d1228f412cf98883117cd6fe17f695",
  "pr_url": "https://github.com/CVCUDA/CV-CUDA/pull/293",
  "pr_number": 293,
  "pr_opened_at": "2026-06-18T21:22:26Z",
  "porting": {
    "arch": "linux-gfx1100",
    "since": "2026-08-20T17:56:44Z"
  },
  "waivers": {
    "windows": {
      "reason": "The CV-CUDA port was deliberately scoped Linux-only, so the obstacle is the platform rather than the GPU. No Windows build work was implemented in the port at all; the Windows platforms are untried followers reusing the Linux branch, and the record notes this was a maintainer call rather than an unexplored gap. Confirmed on windows-gfx1101 and windows-gfx1201. The HIP work is validated at head on linux-gfx90a (wave64) and linux-gfx1100 (wave32); windows is the only gate not satisfied at head. NOTE for the approver: unlike icicle or gpu4pyscf, this is a scoping decision rather than a demonstrated upstream impossibility -- if you would rather see Windows attempted than waived, refuse this and it becomes porter work. Nobody has established that CV-CUDA cannot build on Windows.",
      "suggested_at": "2026-08-20T07:51:32Z"
    }
  },
  "pr_state": "open",
  "license_spdx": "Apache-2.0",
  "upstream_repo_id": 527819251,
  "stage": "porting",
  "platforms": {
    "linux-gfx90a": {
      "state": "completed",
      "blocked": false,
      "blocked_reason": "PORTED. Builds clean for gfx90a (USE_HIP). GPU gate: cvcuda_test_system FULLY GREEN (0 failures, exit 0, 2608 pass, re-confirmed this cycle) -- the operator-correctness gate. nvcv_test_cudatools_system 1116/1123; the 7 residuals are now ROOT-CAUSED to non-production artifacts (no source change needed this cycle). RESIDUAL A (6-8 InterpolationVarShapeWrap.correct_shift, non-deterministic set): a TEST-FIXTURE use-after-free, NOT a GPU/operator/allocator bug. The test issues cudaMemcpy2DAsync from a per-iteration-local std::vector dstVec that is destroyed while the async copy is pending; CUDA's pageable async copy is effectively synchronous (works), HIP's hipMemcpy2DAsync from pageable memory is truly async so it reads the freed/reused buffer and writes garbage into the dst row-stride padding the kernel does not overwrite -> full-strided compare vs a zeroed ref mismatches, failing set varies run-to-run. PROVEN: an alloc-probe shows the production hipMemset(0) zeroes the FULL padded buffer (postMemsetNZ=0); a pre-kernel probe shows padding dirty BEFORE the kernel and unchanged after (kernel never writes padding); keeping dstVec alive (no sync change) OR syncing after the fill makes all 21 pass 3/3 runs, baseline fails 6-8. Conclusively a test-side artifact (upstream UB exposed by HIP semantics); do not edit the test. RESIDUAL B (1 TypeTraitsMakeTypeVectorTest/3): char-vs-signed-char type identity dictated by the upstream HIP vector header (char4 = HIP_vector_type<char,N>, members `char`; CV-CUDA must set BaseType<charN>=char on HIP so the reference accessor binds). Forcing signed char would need a non-canonical HIP_vector_type<signed char,N> family in shared code (per-platform hack, breaks arithmetic); true upstream-header deferral. 1122/1123 with B excluded. Six prior arch-unified root-cause fixes intact (HEAD 74c53d86): texture-pitch clamp 256->32, HistogramEqVarShape memset, PWM PointT union + wave64 BlockReduce __syncthreads, __fsqrt_rn->f64, cuda::min/max NaN match, -ffp-contract=on. Full per-cluster analysis in notes.md; new fault classes added to PORTING_GUIDE.",
      "validated_sha": "642b352642d1228f412cf98883117cd6fe17f695",
      "started_at": "2026-05-31T02:22:53Z",
      "completed_at": "2026-08-08T23:18:13Z",
      "updated_at": "2026-08-08T23:18:13Z",
      "stats": {
        "tokens_total": 0,
        "tokens_approx": true,
        "wall_seconds": {
          "thinking": 0,
          "compile": 0,
          "test": 0,
          "misc": 0
        },
        "session_count": 0,
        "first_session_at": null,
        "last_session_at": null
      },
      "last_agent": "validator",
      "carry_forward": {
        "to": "642b352642d1228f412cf98883117cd6fe17f695",
        "method": "binary-equiv",
        "detail": "Delta (b623dffa..642b3526) is CMakeLists.txt HIP-arch-detection rewrite + a docs-only CMAKE_PREFIX_PATH commit; classify=mixed so built both shas at gfx90a (explicit -DCMAKE_HIP_ARCHITECTURES=gfx90a, ",
        "at": "2026-08-08T23:18:13Z"
      }
    },
    "linux-gfx1100": {
      "state": "completed",
      "blocked": false,
      "blocked_reason": "VALIDATED gfx1100 (RDNA3 wave32, AMD Radeon Pro W7800, ROCm 7.2.1). No source/CMake edit needed (arch-unified port). Build: CLEAN for gfx1100 (DCMAKE_HIP_ARCHITECTURES=gfx1100; 68 code objects all hipv4-amdgcn-amd-amdhsa--gfx1100, zero gfx90a). cvcuda_test_system: 2608 PASSED, 0 FAILED (exit 0) -- identical to gfx90a bar, deterministic 2/2 runs. nvcv_test_cudatools_system: 1107/1123 (16 failures, all within the two documented residual clusters: 15x InterpolationVarShapeWrap.correct_shift = freed-dstVec pageable-async UB in test fixture, more indices exposed on gfx1100 due to RDNA3 more-consistently-async hipMemcpy2DAsync; 1x TypeTraitsMakeTypeVectorTest/3 = char/signed-char type identity). Zero failures outside documented clusters. No new failures. Fork untouched.",
      "validated_sha": "642b352642d1228f412cf98883117cd6fe17f695",
      "started_at": "2026-05-31T18:44:00Z",
      "completed_at": "2026-06-23T21:30:46Z",
      "updated_at": "2026-08-20T17:56:44Z",
      "stats": {
        "tokens_total": 0,
        "tokens_approx": true,
        "wall_seconds": {
          "thinking": 0,
          "compile": 103,
          "test": 340,
          "misc": 0
        },
        "session_count": 1,
        "first_session_at": "2026-05-31T18:44:00Z",
        "last_session_at": "2026-05-31T19:10:00Z"
      },
      "last_agent": "porter:claude",
      "carry_forward": {
        "to": "642b352642d1228f412cf98883117cd6fe17f695",
        "method": "source-class",
        "detail": "CMake default-path change (drop gfx90a pin, rely on enable_language); explicit -DCMAKE_HIP_ARCHITECTURES builds -- how every platform validates -- are byte-identical",
        "at": "2026-06-23T21:30:46Z"
      }
    },
    "windows-gfx1101": {
      "blocked": true,
      "blocked_reason": "Not Windows-ready: the CV-CUDA port is Linux-only (validated on linux-gfx90a + linux-gfx1100); no Windows build work was implemented and the Windows platforms are untried followers reusing the Linux branch. Per maintainer call, not ready for Windows -- do not validate.",
      "validated_sha": null,
      "started_at": null,
      "completed_at": null,
      "updated_at": "2026-06-05T15:48:58Z",
      "stats": {
        "tokens_total": 0,
        "tokens_approx": true,
        "wall_seconds": {
          "thinking": 0,
          "compile": 0,
          "test": 0,
          "misc": 0
        },
        "session_count": 0,
        "first_session_at": null,
        "last_session_at": null
      }
    },
    "windows-gfx1201": {
      "blocked": true,
      "blocked_reason": "Not Windows-ready: the CV-CUDA port is Linux-only (validated on linux-gfx90a + linux-gfx1100); no Windows build work was implemented and the Windows platforms are untried followers reusing the Linux branch. Per maintainer call, not ready for Windows -- do not validate.",
      "validated_sha": null,
      "started_at": null,
      "completed_at": null,
      "updated_at": "2026-06-05T15:48:58Z",
      "stats": {
        "tokens_total": 0,
        "tokens_approx": true,
        "wall_seconds": {
          "thinking": 0,
          "compile": 0,
          "test": 0,
          "misc": 0
        },
        "session_count": 0,
        "first_session_at": null,
        "last_session_at": null
      }
    }
  },
  "published_sha": "642b352642d1228f412cf98883117cd6fe17f695"
}
