{
  "schema_version": 3,
  "name": "CudaSift",
  "upstream_url": "https://github.com/Celebrandil/CudaSift",
  "fork_url": "https://github.com/AMD-Ecosystem/CudaSift",
  "fork_default_branch": "AdaLovelace",
  "priority": 5.346,
  "ext_type": "unknown",
  "adopted_at": "2026-05-29T23:57:04Z",
  "updated_at": "2026-10-16T17:55:39Z",
  "head_sha": "6d1429a1988aab428b91f9113199eed5371712b7",
  "pr_url": "https://github.com/Celebrandil/CudaSift/pull/97",
  "pr_number": 97,
  "pr_opened_at": "2026-06-12T01:04:29Z",
  "porting": null,
  "waivers": {},
  "pr_state": "open",
  "license_spdx": "MIT",
  "upstream_repo_id": 10821793,
  "stage": "review-passed",
  "platforms": {
    "linux-gfx90a": {
      "state": "completed",
      "blocked": false,
      "blocked_reason": null,
      "validated_sha": "6d1429a1988aab428b91f9113199eed5371712b7",
      "started_at": "2026-05-30T00:15:15Z",
      "completed_at": "2026-10-16T17:55:39Z",
      "updated_at": "2026-10-16T17:55:39Z",
      "stats": {
        "tokens_total": 0,
        "tokens_approx": true,
        "wall_seconds": {
          "thinking": 0,
          "compile": 0,
          "test": 0,
          "misc": 0
        },
        "session_count": 0,
        "first_session_at": null,
        "last_session_at": null
      },
      "last_agent": "validator"
    },
    "linux-gfx1100": {
      "state": "completed",
      "blocked": false,
      "blocked_reason": null,
      "validated_sha": "fa25871",
      "started_at": null,
      "completed_at": "2026-06-23T22:18:21Z",
      "updated_at": "2026-06-23T22:18:21Z",
      "stats": {
        "tokens_total": 0,
        "tokens_approx": true,
        "wall_seconds": {
          "thinking": 0,
          "compile": 0,
          "test": 0,
          "misc": 0
        },
        "session_count": 0,
        "first_session_at": null,
        "last_session_at": null
      },
      "last_agent": "validator",
      "carry_forward": {
        "to": "fa25871",
        "method": "source-class",
        "detail": "gfx90a pin removal; CMake default-path/dead-code change, build byte-identical, no GPU re-run",
        "at": "2026-06-23T22:18:21Z"
      }
    },
    "windows-gfx1101": {
      "state": "completed",
      "blocked": false,
      "blocked_reason": null,
      "validated_sha": "fa25871",
      "started_at": null,
      "completed_at": "2026-06-23T22:18:22Z",
      "updated_at": "2026-06-23T22:18:22Z",
      "stats": {
        "tokens_total": 0,
        "tokens_approx": true,
        "wall_seconds": {
          "thinking": 0,
          "compile": 0,
          "test": 0,
          "misc": 0
        },
        "session_count": 0,
        "first_session_at": null,
        "last_session_at": null
      },
      "last_agent": "validator",
      "carry_forward": {
        "to": "fa25871",
        "method": "source-class",
        "detail": "gfx90a pin removal; CMake default-path/dead-code change, build byte-identical, no GPU re-run",
        "at": "2026-06-23T22:18:22Z"
      }
    },
    "windows-gfx1201": {
      "state": "completed",
      "blocked": false,
      "blocked_reason": null,
      "validated_sha": "fa25871",
      "started_at": null,
      "completed_at": "2026-06-23T22:18:22Z",
      "updated_at": "2026-06-23T22:18:22Z",
      "stats": {
        "tokens_total": 0,
        "tokens_approx": true,
        "wall_seconds": {
          "thinking": 0,
          "compile": 0,
          "test": 0,
          "misc": 0
        },
        "session_count": 0,
        "first_session_at": null,
        "last_session_at": null
      },
      "last_agent": "validator",
      "carry_forward": {
        "to": "fa25871",
        "method": "source-class",
        "detail": "gfx90a pin removal; CMake default-path/dead-code change, build byte-identical, no GPU re-run",
        "at": "2026-06-23T22:18:22Z"
      }
    },
    "windows-gfx1151": {
      "state": "completed",
      "blocked": false,
      "blocked_reason": null,
      "validated_sha": "6d1429a1988aab428b91f9113199eed5371712b7",
      "started_at": "2026-10-16T17:31:13Z",
      "completed_at": "2026-10-16T17:44:39Z",
      "updated_at": "2026-10-16T17:44:39Z",
      "stats": {
        "tokens_total": 0,
        "tokens_approx": true,
        "wall_seconds": {
          "thinking": 0,
          "compile": 0,
          "test": 0,
          "misc": 0
        },
        "session_count": 0,
        "first_session_at": null,
        "last_session_at": null
      },
      "last_agent": "validator"
    }
  },
  "published_sha": "fa258712a8d0ee0763dd42e698578042683fb44f",
  "fix": {
    "branch": "moat-fix-97",
    "base_sha": "fa258712a8d0ee0763dd42e698578042683fb44f",
    "review_pr": null,
    "opened_at": "2026-10-16T17:30:41Z"
  },
  "porting_released": {
    "arch": "windows-gfx1151",
    "since": "2026-10-16T17:40:57Z",
    "at": "2026-10-16T17:42:58Z"
  }
}
