{
  "schema_version": 3,
  "name": "op43dgs",
  "upstream_url": "https://github.com/LetianHuang/op43dgs",
  "fork_url": "https://github.com/AMD-Ecosystem/op43dgs",
  "fork_default_branch": "main",
  "priority": 3.393,
  "ext_type": "torch-extension",
  "adopted_at": "2026-05-30T01:04:50Z",
  "updated_at": "2026-08-20T04:41:58Z",
  "head_sha": "d6ca89206f8e8881598c1694a6ca996332952599",
  "porting": null,
  "waivers": {},
  "license_clearance": {
    "approved_by": "jeffdaily",
    "at": "2026-08-06T02:41:27Z",
    "tier": 4,
    "note": "carries the org review of 2026-08-06: the risk is in USING these projects, not in contributing to them; covers this project only"
  },
  "license_spdx": "non-commercial",
  "upstream_repo_id": 824214391,
  "stage": "ported",
  "platforms": {
    "linux-gfx90a": {
      "state": "completed",
      "blocked": false,
      "blocked_reason": null,
      "validated_sha": "d6ca89206f8e8881598c1694a6ca996332952599",
      "started_at": "2026-06-01T00:39:24Z",
      "completed_at": "2026-06-08T00:26:12Z",
      "updated_at": "2026-08-20T04:41:58Z",
      "stats": {
        "tokens_total": 0,
        "tokens_approx": true,
        "wall_seconds": {
          "thinking": 0,
          "compile": 0,
          "test": 0,
          "misc": 0
        },
        "session_count": 0,
        "first_session_at": null,
        "last_session_at": null
      },
      "last_agent": "validator",
      "carry_forward": {
        "from": "87173958ed14a2924349187e9e9f2744cee2c93a",
        "to": "d6ca89206f8e8881598c1694a6ca996332952599",
        "method": "source-class",
        "class": "doc-only",
        "detail": "no changes",
        "at": "2026-08-20T04:40:00Z"
      }
    },
    "linux-gfx1100": {
      "state": "completed",
      "blocked": false,
      "blocked_reason": null,
      "validated_sha": "d6ca89206f8e8881598c1694a6ca996332952599",
      "started_at": "2026-06-01T20:35:00Z",
      "completed_at": "2026-06-08T00:54:41Z",
      "updated_at": "2026-08-20T04:40:00Z",
      "stats": {
        "tokens_total": 0,
        "tokens_approx": true,
        "wall_seconds": {
          "thinking": 0,
          "compile": 0,
          "test": 0,
          "misc": 0
        },
        "session_count": 1,
        "first_session_at": "2026-06-01T20:35:00Z",
        "last_session_at": "2026-06-01T20:47:00Z"
      },
      "last_agent": "validator",
      "carry_forward": {
        "from": "87173958ed14a2924349187e9e9f2744cee2c93a",
        "to": "d6ca89206f8e8881598c1694a6ca996332952599",
        "method": "source-class",
        "class": "doc-only",
        "detail": "no changes",
        "at": "2026-08-20T04:40:00Z"
      }
    },
    "windows-gfx1101": {
      "state": "completed",
      "blocked": false,
      "blocked_reason": null,
      "validated_sha": "d6ca89206f8e8881598c1694a6ca996332952599",
      "started_at": null,
      "completed_at": "2026-06-20T04:25:35Z",
      "updated_at": "2026-08-20T04:40:00Z",
      "stats": {
        "tokens_total": 0,
        "tokens_approx": true,
        "wall_seconds": {
          "thinking": 0,
          "compile": 0,
          "test": 0,
          "misc": 0
        },
        "session_count": 0,
        "first_session_at": null,
        "last_session_at": null
      },
      "last_agent": "validator",
      "carry_forward": {
        "from": "87173958ed14a2924349187e9e9f2744cee2c93a",
        "to": "d6ca89206f8e8881598c1694a6ca996332952599",
        "method": "source-class",
        "class": "doc-only",
        "detail": "no changes",
        "at": "2026-08-20T04:40:00Z"
      }
    },
    "windows-gfx1201": {
      "state": "completed",
      "blocked": false,
      "blocked_reason": null,
      "validated_sha": "d6ca89206f8e8881598c1694a6ca996332952599",
      "started_at": "2026-06-07T22:17:32Z",
      "completed_at": "2026-06-07T22:17:32Z",
      "updated_at": "2026-08-20T04:40:00Z",
      "stats": {
        "tokens_total": 0,
        "tokens_approx": true,
        "wall_seconds": {
          "thinking": 0,
          "compile": 0,
          "test": 0,
          "misc": 0
        },
        "session_count": 0,
        "first_session_at": null,
        "last_session_at": null
      },
      "last_agent": "validator",
      "carry_forward": {
        "from": "87173958ed14a2924349187e9e9f2744cee2c93a",
        "to": "d6ca89206f8e8881598c1694a6ca996332952599",
        "method": "source-class",
        "class": "doc-only",
        "detail": "no changes",
        "at": "2026-08-20T04:40:00Z"
      }
    }
  },
  "porting_released": {
    "arch": "linux-gfx90a",
    "since": "2026-08-20T04:38:48Z",
    "at": "2026-08-20T04:41:58Z"
  }
}
