{
  "schema_version": 3,
  "name": "mcx",
  "upstream_url": "https://github.com/fangq/mcx",
  "fork_url": "https://github.com/AMD-Ecosystem/mcx",
  "fork_default_branch": "master",
  "priority": 0.0,
  "ext_type": "cmake",
  "adopted_at": "2026-06-04T23:23:31Z",
  "updated_at": "2026-10-09T15:40:56Z",
  "head_sha": "d38c7aaa2f8d",
  "depends_on": [],
  "pr_url": "https://github.com/fangq/mcx/pull/264",
  "pr_number": 264,
  "pr_opened_at": "2026-06-16T17:03:53Z",
  "pr_merged_at": "2026-06-18T18:54:00Z",
  "porting": null,
  "waivers": {},
  "pr_state": "merged",
  "license_clearance": {
    "approved_by": "jeffdaily",
    "at": "2026-08-06T02:33:28Z",
    "tier": 3,
    "note": "carries the org review that cleared this specific list on 2026-08-06; covers this project only and sets no precedent for its tier"
  },
  "license_spdx": "GPL-3.0-or-later",
  "upstream_repo_id": 29803383,
  "stage": "review-passed",
  "platforms": {
    "windows-gfx1101": {
      "state": "completed",
      "blocked": false,
      "blocked_reason": null,
      "validated_sha": "d38c7aaa2f8d",
      "started_at": null,
      "completed_at": "2026-06-20T03:19:23Z",
      "updated_at": "2026-06-20T03:19:23Z",
      "stats": {
        "tokens_total": 0,
        "tokens_approx": true,
        "wall_seconds": {
          "thinking": 0,
          "compile": 0,
          "test": 0,
          "misc": 0
        },
        "session_count": 0,
        "first_session_at": null,
        "last_session_at": null
      },
      "last_agent": "validator"
    },
    "linux-gfx1100": {
      "state": "completed",
      "blocked": false,
      "blocked_reason": null,
      "validated_sha": "d38c7aaa2f8d",
      "started_at": null,
      "completed_at": "2026-06-18T19:23:36Z",
      "updated_at": "2026-06-18T19:23:36Z",
      "stats": {
        "tokens_total": 0,
        "tokens_approx": true,
        "wall_seconds": {
          "thinking": 0,
          "compile": 0,
          "test": 0,
          "misc": 0
        },
        "session_count": 0,
        "first_session_at": null,
        "last_session_at": null
      },
      "last_agent": "validator"
    },
    "windows-gfx1201": {
      "state": "completed",
      "blocked": false,
      "blocked_reason": null,
      "validated_sha": "d38c7aaa2f8d",
      "started_at": null,
      "completed_at": "2026-06-17T05:27:28Z",
      "updated_at": "2026-06-17T05:27:28Z",
      "stats": {
        "tokens_total": 0,
        "tokens_approx": true,
        "wall_seconds": {
          "thinking": 0,
          "compile": 0,
          "test": 0,
          "misc": 0
        },
        "session_count": 0,
        "first_session_at": null,
        "last_session_at": null
      },
      "last_agent": "validator"
    },
    "linux-gfx90a": {
      "state": "completed",
      "blocked": false,
      "blocked_reason": null,
      "validated_sha": "d38c7aaa2f8d",
      "started_at": "2026-06-04T23:45:54Z",
      "completed_at": "2026-08-09T00:27:13Z",
      "updated_at": "2026-08-09T00:27:13Z",
      "stats": {
        "tokens_total": 0,
        "tokens_approx": true,
        "wall_seconds": {
          "thinking": 0,
          "compile": 0,
          "test": 0,
          "misc": 0
        },
        "session_count": 0,
        "first_session_at": null,
        "last_session_at": null
      },
      "last_agent": "validator"
    }
  },
  "published_sha": "d38c7aaa2f8de184ad276e34d9cc5a13371642dc"
}
