{
  "schema_version": 2,
  "name": "Gpufit",
  "upstream_url": "https://github.com/gpufit/Gpufit",
  "fork_url": "https://github.com/AMD-Ecosystem/Gpufit",
  "fork_default_branch": "master",
  "priority": 4.647,
  "ext_type": "cmake",
  "adopted_at": "2026-05-30T01:04:51Z",
  "updated_at": "2026-08-07T07:04:37Z",
  "head_sha": "02fc60fd02e4e9e6e4e9645dffeb1af190322b20",
  "pr_url": "https://github.com/gpufit/Gpufit/pull/149",
  "porting": null,
  "waivers": {},
  "pr_state": "open",
  "license_spdx": "MIT",
  "upstream_repo_id": 99810999,
  "stage": "review-passed",
  "platforms": {
    "linux-gfx90a": {
      "state": "completed",
      "blocked": false,
      "blocked_reason": null,
      "validated_sha": "02fc60fd02e4e9e6e4e9645dffeb1af190322b20",
      "started_at": "2026-05-30T05:07:21Z",
      "completed_at": "2026-06-23T22:51:05Z",
      "updated_at": "2026-06-23T22:51:05Z",
      "stats": {
        "tokens_total": 0,
        "tokens_approx": true,
        "wall_seconds": {
          "thinking": 0,
          "compile": 0,
          "test": 0,
          "misc": 0
        },
        "session_count": 0,
        "first_session_at": null,
        "last_session_at": null
      },
      "last_agent": "validator",
      "carry_forward": {
        "to": "02fc60fd02e4e9e6e4e9645dffeb1af190322b20",
        "method": "source-class",
        "detail": "gfx90a pin removal; CMake default-path/dead-code change, build byte-identical, no GPU re-run",
        "at": "2026-06-23T22:51:05Z"
      }
    },
    "linux-gfx1100": {
      "state": "completed",
      "blocked": false,
      "blocked_reason": null,
      "validated_sha": "02fc60fd02e4e9e6e4e9645dffeb1af190322b20",
      "started_at": "2026-05-30T06:15:16Z",
      "completed_at": "2026-06-23T22:51:05Z",
      "updated_at": "2026-06-23T22:51:05Z",
      "stats": {
        "tokens_total": 0,
        "tokens_approx": true,
        "wall_seconds": {
          "thinking": 0,
          "compile": 0,
          "test": 0,
          "misc": 0
        },
        "session_count": 0,
        "first_session_at": null,
        "last_session_at": null
      },
      "last_agent": "validator",
      "carry_forward": {
        "to": "02fc60fd02e4e9e6e4e9645dffeb1af190322b20",
        "method": "source-class",
        "detail": "gfx90a pin removal; CMake default-path/dead-code change, build byte-identical, no GPU re-run",
        "at": "2026-06-23T22:51:05Z"
      }
    },
    "windows-gfx1101": {
      "state": "completed",
      "blocked": false,
      "blocked_reason": null,
      "validated_sha": "02fc60fd02e4e9e6e4e9645dffeb1af190322b20",
      "started_at": null,
      "completed_at": "2026-06-23T22:51:05Z",
      "updated_at": "2026-06-23T22:51:05Z",
      "stats": {
        "tokens_total": 0,
        "tokens_approx": true,
        "wall_seconds": {
          "thinking": 0,
          "compile": 0,
          "test": 0,
          "misc": 0
        },
        "session_count": 0,
        "first_session_at": null,
        "last_session_at": null
      },
      "last_agent": "validator",
      "carry_forward": {
        "to": "02fc60fd02e4e9e6e4e9645dffeb1af190322b20",
        "method": "source-class",
        "detail": "gfx90a pin removal; CMake default-path/dead-code change, build byte-identical, no GPU re-run",
        "at": "2026-06-23T22:51:05Z"
      }
    },
    "windows-gfx1201": {
      "state": "completed",
      "blocked": false,
      "blocked_reason": null,
      "validated_sha": "02fc60fd02e4e9e6e4e9645dffeb1af190322b20",
      "started_at": null,
      "completed_at": "2026-06-23T22:51:05Z",
      "updated_at": "2026-06-23T22:51:05Z",
      "stats": {
        "tokens_total": 0,
        "tokens_approx": true,
        "wall_seconds": {
          "thinking": 0,
          "compile": 0,
          "test": 0,
          "misc": 0
        },
        "session_count": 0,
        "first_session_at": null,
        "last_session_at": null
      },
      "last_agent": "validator",
      "carry_forward": {
        "to": "02fc60fd02e4e9e6e4e9645dffeb1af190322b20",
        "method": "source-class",
        "detail": "gfx90a pin removal; CMake default-path/dead-code change, build byte-identical, no GPU re-run",
        "at": "2026-06-23T22:51:05Z"
      }
    }
  }
}
