{
  "schema_version": 3,
  "name": "dgSPARSE-Lib",
  "upstream_url": "https://github.com/dgSPARSE/dgSPARSE-Lib",
  "fork_url": "https://github.com/AMD-Ecosystem/dgSPARSE-Lib",
  "fork_default_branch": "main",
  "priority": 0.0,
  "ext_type": "torch-extension",
  "adopted_at": "2026-06-05T01:25:53Z",
  "updated_at": "2026-08-07T07:05:00Z",
  "head_sha": "1ff4c69b407bfc756e4d084bcdcdbda89171e358",
  "depends_on": [],
  "pr_url": "https://github.com/dgSPARSE/dgSPARSE-Lib/pull/39",
  "pr_number": 39,
  "pr_opened_at": "2026-06-20T00:42:17Z",
  "porting": null,
  "waivers": {},
  "pr_state": "open",
  "license_spdx": "MIT",
  "upstream_repo_id": 381729183,
  "stage": "review-passed",
  "platforms": {
    "linux-gfx90a": {
      "state": "completed",
      "blocked": false,
      "blocked_reason": null,
      "validated_sha": "1ff4c69b407bfc756e4d084bcdcdbda89171e358",
      "started_at": "2026-06-05T08:59:07Z",
      "completed_at": "2026-06-08T17:47:28Z",
      "updated_at": "2026-06-20T00:50:38Z",
      "stats": {
        "tokens_total": 0,
        "tokens_approx": true,
        "wall_seconds": {
          "thinking": 0,
          "compile": 0,
          "test": 0,
          "misc": 0
        },
        "session_count": 0,
        "first_session_at": null,
        "last_session_at": null
      },
      "last_agent": "validator",
      "carry_forward": {
        "to": "1ff4c69b407bfc756e4d084bcdcdbda89171e358",
        "method": "binary-equiv",
        "detail": "pre-commit.ci formatting (yapf/clang-format/flake8 wrap); device changes are include-reordering confined to CUDA #else branches + build-script only, so HIP preprocessed source is byte-identical -> dev",
        "at": "2026-06-20T00:50:38Z"
      }
    },
    "linux-gfx1100": {
      "state": "completed",
      "blocked": false,
      "blocked_reason": null,
      "validated_sha": "1ff4c69b407bfc756e4d084bcdcdbda89171e358",
      "started_at": "2026-06-05T15:17:04.603546+00:00",
      "completed_at": "2026-06-20T00:50:38Z",
      "updated_at": "2026-06-20T00:50:38Z",
      "stats": {
        "tokens_total": 0,
        "tokens_approx": true,
        "wall_seconds": {
          "thinking": 0,
          "compile": 0,
          "test": 0,
          "misc": 0
        },
        "session_count": 0,
        "first_session_at": null,
        "last_session_at": null
      },
      "last_agent": "validator",
      "carry_forward": {
        "to": "1ff4c69b407bfc756e4d084bcdcdbda89171e358",
        "method": "binary-equiv",
        "detail": "pre-commit.ci formatting (yapf/clang-format/flake8 wrap); device changes are include-reordering confined to CUDA #else branches + build-script only, so HIP preprocessed source is byte-identical -> dev",
        "at": "2026-06-20T00:50:38Z"
      }
    },
    "windows-gfx1101": {
      "state": "completed",
      "blocked": false,
      "blocked_reason": null,
      "validated_sha": "1ff4c69b407bfc756e4d084bcdcdbda89171e358",
      "started_at": null,
      "completed_at": "2026-06-20T00:50:38Z",
      "updated_at": "2026-06-20T00:50:38Z",
      "stats": {
        "tokens_total": 0,
        "tokens_approx": true,
        "wall_seconds": {
          "thinking": 0,
          "compile": 0,
          "test": 0,
          "misc": 0
        },
        "session_count": 0,
        "first_session_at": null,
        "last_session_at": null
      },
      "last_agent": "validator",
      "carry_forward": {
        "to": "1ff4c69b407bfc756e4d084bcdcdbda89171e358",
        "method": "binary-equiv",
        "detail": "pre-commit.ci formatting (yapf/clang-format/flake8 wrap); device changes are include-reordering confined to CUDA #else branches + build-script only, so HIP preprocessed source is byte-identical -> dev",
        "at": "2026-06-20T00:50:38Z"
      }
    },
    "windows-gfx1201": {
      "state": "completed",
      "blocked": false,
      "blocked_reason": null,
      "validated_sha": "1ff4c69b407bfc756e4d084bcdcdbda89171e358",
      "started_at": null,
      "completed_at": "2026-06-20T00:50:38Z",
      "updated_at": "2026-06-20T00:50:38Z",
      "stats": {
        "tokens_total": 0,
        "tokens_approx": true,
        "wall_seconds": {
          "thinking": 0,
          "compile": 0,
          "test": 0,
          "misc": 0
        },
        "session_count": 0,
        "first_session_at": null,
        "last_session_at": null
      },
      "last_agent": "validator",
      "carry_forward": {
        "to": "1ff4c69b407bfc756e4d084bcdcdbda89171e358",
        "method": "binary-equiv",
        "detail": "pre-commit.ci formatting (yapf/clang-format/flake8 wrap); device changes are include-reordering confined to CUDA #else branches + build-script only, so HIP preprocessed source is byte-identical -> dev",
        "at": "2026-06-20T00:50:38Z"
      }
    }
  }
}
